{"general_info":{"course_id":"ΗΥ-108","course_title":"ΑΓΓΛΙΚΑ Ι","instructor":"ΠΑΝΑΓΙΩΤΑ ΡΙΖΟΠΟΥΛΟΥ","teaching_semester":"ΧΕΙΜΕΡΙΝΟ","school":"ΘΕΤΙΚΩΝ ΚΑΙ ΤΕΧΝΟΛΟΓΙΚΩΝ ΕΠΙΣΤΗΜΩΝ","department":"ΕΠΙΣΤΗΜΗΣ ΥΠΟΛΟΓΙΣΤΩΝ","study_level":"ΠΡΟΠΤΥΧΙΑΚΟ","semester_of_studies":"1ο","autonomous_teaching_activities":{"activity_type":"Διαλέξεις","weekly_teaching_hours":4,"ects_credits":4},"course_type":"Ανάπτυξης Δεξιοτήτων","language_of_instruction_and_exams":"Ελληνική / Αγγλική","offered_to_erasmus_students":"ΝΑΙ","course_website":"https://www.csd.uoc.gr/~hy108"},"course_objectives":{"learning_outcomes_text":"Μέσα από μια σειρά διαλέξεων, το μάθημα επιχειρεί να εφοδιάσει τους φοιτητές με το βασικό γλωσσικό υπόβαθρο στην επιστήμη των υπολογιστών.  Μετά την επιτυχή ολοκλήρωση του μαθήματος, οι φοιτητές θα μπορούν να κατανοούν ποικιλία ακαδημαϊκών κειμένων στην επιστήμη τους και θα έχουν αποκτήσει ευχέρεια σε προ-γραφικές ασκήσεις όπως: παράφραση, περίληψη, μεταφορές, αναλογίες και προσομοιώσεις δεξιοτήτων.","general_competencies":["Αναζήτηση, ανάλυση και σύνθεση δεδομένων και πληροφοριών, με τη χρήση και των απαραίτητων τεχνολογιών","Ομαδική εργασία","Επίδειξη κοινωνικής, επαγγελματικής και ηθικής υπευθυνότητας και ευαισθησίας σε θέματα φύλου","Άσκηση κριτικής και αυτοκριτικής","Προαγωγή της ελεύθερης, δημιουργικής και επαγωγικής σκέψης"]},"course_content":"Παράλληλα με την σχετική αγγλική ορολογία, διδάσκονται βασικά γλωσσολογικά εργαλεία, ώστε να διευκολυνθεί περαιτέρω η ένταξη των φοιτητών στη θεωρία των υπολογιστών και στην στοιχειώδη ακαδημαϊκή επικοινωνία.\n\nFoundations of Computer Science\n• Introduction\n• Data Storage\n• Data Manipulation\n• Operating Systems\n• Networking and the Internet\n• Algorithms\n• Programming Languages\n• Software Engineering\n• Data Abstractions\n• Database Systems\n• Artificial Intelligence\n• Theory of Computation\n• Re-writing and Proof-reading","student_evaluation":{"delivery_mode":"Πρόσωπο με πρόσωπο (αίθουσα διδασκαλίας)","use_of_ict":["Ηλεκτρονικό ταχυδρομείο","Ιστοσελίδα μαθήματος"],"learning_activities_and_workload":[{"activity":"Διαλέξεις","workload_hours":52},{"activity":"Μελέτη βιβλιογραφίας","workload_hours":50}],"total_workload_hours":102,"assessment":{"assessment_language":"αγγλική","components":[{"name":"Τελική γραπτή εξέταση","weight":"100%"}]}},"suggested_bibliography":"Σημειώσεις της διδάσκουσας"}
