{"general_info":{"course_id":"ΗΥ-446","course_title":"ΣΥΣΤΗΜΑΤΑ ΕΚΤΕΛΕΣΗΣ ΔΥΝΑΜΙΚΩΝ ΓΛΩΣΣΩΝ ΠΡΟΓΡΑΜΜΑΤΙΣΜΟΥ","instructor":"ΠΟΛΥΒΙΟΣ ΠΡΑΤΙΚΑΚΗΣ","teaching_semester":"ΕΑΡΙΝΟ","school":"ΘΕΤΙΚΩΝ ΚΑΙ ΤΕΧΝΟΛΟΓΙΚΩΝ ΕΠΙΣΤΗΜΩΝ","department":"ΕΠΙΣΤΗΜΗΣ ΥΠΟΛΟΓΙΣΤΩΝ","study_level":"ΠΡΟΠΤΥΧΙΑΚΟ / ΜΕΤΑΠΤΥΧΙΑΚΟ","semester_of_studies":"6o-8o","autonomous_teaching_activities":{"activity_type":"Διαλέξεις και φροντιστήρια","weekly_teaching_hours":4,"ects_credits":6},"course_type":"Επιστημονικής Περιοχής Ε4","prerequisite_courses":["ΗΥ-252","ΗΥ-345"],"language_of_instruction_and_exams":"Ελληνική. Ενδέχεται να γίνεται και στην Αγγλική εάν υπάρχει ενδιαφέρον από αγγλόφωνο ακροατήριο.","offered_to_erasmus_students":"ΝΑΙ","course_website":"www.csd.uoc.gr/~hy446"},"course_objectives":{"learning_outcomes_text":"Οι φοιτητές, μετά την επιτυχή ολοκλήρωση του μαθήματος\n\n θα κατέχουν βασικές έννοιες σχετικές με τις managed γλώσσες προγραμματισμού, και ειδικότερα τη γλώσσα Java, την εικονική μηχανή JVM που την εκτελεί, τους μεταγλωττιστές JIT και τη λειτουργία εργαλείων αυτόματης διαχείρισης μνήμης και garbage collection.\n\n θα έχουν εξοικειωθεί με εργαλεία profiling, μεταγλωττιστές, και εικονικές μηχανές JVM.\n\n θα είναι σε θέση να εκμεταλλευτούν τα χαρακτηριστικά και τη λειτουργία των εικονικών μηχανών Java για να βελτιστοποιήσουν την απόδοση αντίστοιχων προγραμμάτων.","general_competencies":["Αναζήτηση, ανάλυση και σύνθεση δεδομένων και πληροφοριών, με τη χρήση και των απαραίτητων τεχνολογιών","Προσαρμογή σε νέες καταστάσεις","Λήψη αποφάσεων","Αυτόνομη εργασία","Ομαδική εργασία","Παραγωγή νέων ερευνητικών ιδεών","Προαγωγή της ελεύθερης, δημιουργικής και επαγωγικής σκέψης"]},"course_content":"Στο μάθημα αυτό μελετάμε πως υλοποιούνται οι δυναμικές γλώσσες προγραμματισμού στα συστήματα εκτέλεσης δυναμικών γλωσσών προγραμματισμού και συγκεκριμένα στην γλώσσα προγραμματισμού Java. Ακόμη εστιάζουμε στο πως δουλεύει η αυτόματη διαχείριση μνήμης και πως βελτιώνουν τον κώδικα κατά τον χρόνο εκτέλεσης οι just-in-time μεταγλωττιστές.\n\nΎλη μαθήματος:\n\n Introduction: What is a managed runtime system\n Bytecode Interpretation\n Garbage Collection\n Just In Time Compilation\n Metacircular VMs\n Concurrency and Memory Models\n Advanced Garbage Collection\n Profiling and Adaptive Optimization","student_evaluation":{"delivery_mode":"Πρόσωπο με πρόσωπο (αίθουσα διδασκαλίας)","use_of_ict":["Ηλεκτρονικό ταχυδρομείο","Ιστοσελίδα μαθήματος","Ηλεκτρονική υποβολή ασκήσεων"],"learning_activities_and_workload":[{"activity":"Διαλέξεις / φροντιστήρια","workload_hours":52},{"activity":"Project","workload_hours":80},{"activity":"Μελέτη βιβλιογραφίας","workload_hours":35}],"total_workload_hours":167,"assessment":{"assessment_language":"Γλώσσα ελληνική. Ενδέχεται να γίνεται και στην Αγγλική εάν υπάρχει ενδιαφέρον από αγγλόφωνο ακροατήριο και δεν υπάρχει αντίρρηση από το ελληνόφωνο ακροατήριο.","components":[{"name":"Μελέτη βιβλιογραφίας","weight":"35%"},{"name":"Project","weight":"50%"},{"name":"Παρακολούθηση","weight":"15%"}]}},"suggested_bibliography":"Υλικό στην ιστοσελίδα του μαθήματος"}
