{"general_info":{"course_id":"ΗΥ-454","course_title":"ΤΕΧΝΟΛΟΓΙΑ ΑΝΑΠΤΥΞΗΣ ΕΞΥΠΝΩΝ ΔΙΕΠΑΦΩΝ ΚΑΙ ΠΑΙΧΝΙΔΙΩΝ","instructor":"ΑΝΤΩΝΙΟΣ ΣΑΒΒΙΔΗΣ","teaching_semester":"ΧΕΙΜΕΡΙΝΟ","school":"ΘΕΤΙΚΩΝ ΚΑΙ ΤΕΧΝΟΛΟΓΙΚΩΝ ΕΠΙΣΤΗΜΩΝ","department":"ΕΠΙΣΤΗΜΗΣ ΥΠΟΛΟΓΙΣΤΩΝ","study_level":"ΠΡΟΠΤΥΧΙΑΚΟ / ΜΕΤΑΠΤΥΧΙΑΚΟ","semester_of_studies":"5o-8o","autonomous_teaching_activities":{"activity_type":"Διαλέξεις και φροντιστήρια","weekly_teaching_hours":6,"ects_credits":6},"course_type":"Επιστημονικής Περιοχής Ε5","prerequisite_courses":["HY-255"],"language_of_instruction_and_exams":"Ελληνική. Ενδέχεται να γίνεται και στην Αγγλική εάν υπάρχει ενδιαφέρον από αγγλόφωνο ακροατήριο.","offered_to_erasmus_students":"ΝΑΙ","course_website":"http://www.csd.uoc.gr/~hy454"},"course_objectives":{"learning_outcomes_text":"Με την επιτυχή ολοκλήρωση του μαθήματος οι φοιτητές έχουν κατανόηση των θεμάτων σχετικών με την τεχνολογία ανάπτυξης έξυπνων διεπαφών και παιχνιδιών:\n\n• Της σύγχρονης τεχνολογίας λογισµικού και των κυρίαρχων εργαλείων\n• Την ανάπτυξη εφαρµογών που έχουν προηγµένες διεπαφές\n• Την υποστήριξη ευφυούς, κινητής, και πολυµεσικής αλληλεπίδρασης","general_competencies":["Αναζήτηση, ανάλυση και σύνθεση δεδομένων και πληροφοριών, με τη χρήση και των απαραίτητων τεχνολογιών","Προσαρμογή σε νέες καταστάσεις","Λήψη αποφάσεων","Αυτόνομη εργασία","Ομαδική εργασία","Σχεδιασμός και διαχείριση έργων","Προαγωγή της ελεύθερης, δημιουργικής και επαγωγικής σκέψης"]},"course_content":"• αρχιτεκτονικές, αλγόριθµοι, µοντέλα, APIs, βιβλιοθήκες λογισµικού, σχεδιαστικά λογισµικά πρότυπα, εργαλεία, πρωτόκολλα, τεχνικές σχεδίασης και ποικίλα αποσπάσµατα από υπάρχοντα συστήµατα για την αντιµετώπιση του σύνθετου κατασκευαστικού προβλήµατος διεπαφών µε τις παραπάνω ιδιότητες.\n\n• Τα αντιπροσωπευτικότερα πεδία εφαρµογών τα οποία εξυπηρετούν οι τεχνικές που θα διδαχθείτε στο µάθηµα αυτό είναι: έξυπνα συστήµατα αλληλεπίδρασης (intelligent user interfaces), ηλεκτρονικά παιχνίδια (computer games) και συστήµατα διάχυτης ευφυΐας (ambient intelligence systems).","student_evaluation":{"delivery_mode":"Πρόσωπο με πρόσωπο (αίθουσα διδασκαλίας)","use_of_ict":["Ηλεκτρονικό ταχυδρομείο","Ιστοσελίδα μαθήματος","Ηλεκτρονική υποβολή ασκήσεων"],"learning_activities_and_workload":[{"activity":"Διαλέξεις","workload_hours":52},{"activity":"Εργαστήρια / Φροντιστήρια","workload_hours":26},{"activity":"Εργαστηριακές ασκήσεις - Project","workload_hours":50},{"activity":"Μελέτη θεωρίας","workload_hours":50}],"total_workload_hours":178,"assessment":{"components":[{"name":"ομαδική εργασία","weight":"Ε"},{"name":"τελική εξέταση","weight":"Τ"}]}},"suggested_bibliography":""}
