{"general_info":{"course_id":"ΗΥ-459","course_title":"ΜΕΤΡΗΣΗ ΚΑΙ ΕΠΟΠΤΕΙΑ ΤΟΥ ΔΙΑΔΙΚΤΥΟΥ","instructor":"ΕΥΑΓΓΕΛΟΣ ΜΑΡΚΑΤΟΣ","teaching_semester":"ΕΑΡΙΝΟ","school":"ΘΕΤΙΚΩΝ ΚΑΙ ΤΕΧΝΟΛΟΓΙΚΩΝ ΕΠΙΣΤΗΜΩΝ","department":"ΕΠΙΣΤΗΜΗΣ ΥΠΟΛΟΓΙΣΤΩΝ","study_level":"ΠΡΟΠΤΥΧΙΑΚΟ / ΜΕΤΑΠΤΥΧΙΑΚΟ","semester_of_studies":"6o-8o","autonomous_teaching_activities":{"activity_type":"Διαλέξεις και φροντιστήρια","weekly_teaching_hours":6,"ects_credits":6},"course_type":"Επιστημονικής Περιοχής Ε5","prerequisite_courses":["HY-345"],"language_of_instruction_and_exams":"Ελληνική. Ενδέχεται να γίνεται και στην Αγγλική εάν υπάρχει ενδιαφέρον από αγγλόφωνο ακροατήριο.","offered_to_erasmus_students":"ΝΑΙ","course_website":"http://www.csd.uoc.gr/~hy459/"},"course_objectives":{"learning_outcomes_text":"Οι φοιτητές, μετά την επιτυχή ολοκλήρωση του μαθήματος\n\n θα κατέχουν τις βασικές έννοιες της εποπτείας των δικτύων υπολογιστών\n\n θα έχουν εξοικειωθεί με εργαλεία ανάλυσης απόδοσης δικτύων\n\n θα έχουν μάθει τις βασικές αρχές της θεωρίας ανάλυσης απόδοσης δικτύων, και\n\n θα είναι σε θέση να υλοποιήσουν νέα εργαλεία μετρήσεων και εποπτείας του\nδιαδικτύου","general_competencies":["Αναζήτηση, ανάλυση και σύνθεση δεδομένων και πληροφοριών, με τη χρήση και των απαραίτητων τεχνολογιών","Προσαρμογή σε νέες καταστάσεις","Λήψη αποφάσεων","Αυτόνομη εργασία","Ομαδική εργασία","Σχεδιασμός και διαχείριση έργων","Προαγωγή της ελεύθερης, δημιουργικής και επαγωγικής σκέψης"]},"course_content":" Εισαγωγή.\n Βασικές αρχές της αρχιτεκτονικής του Διαδικτύου.\n Πρακτικά θέματα μετρήσεων: (α) ο ρόλος του χρόνου, (β) ο ρόλος των καταλόγων του\n Διαδικτύου, (γ) που μπορούν να γίνουν μετρήσεις?\n Υποδομή: προκλήσεις και εργαλεία.\n Αντιγραφή κυκλοφορίας του Διαδικτύου: εργαλεία και μεθοδολογία.\n Εφαρμογές: DNS, παγκόσμιος ιστός, ομότιμα συστήματα, παιχνίδια.\n Ανωνυμία, ασφάλεια.\n Προχωρημένα θέματα: YouTube, τομογραφία δικτύου, ιδιωτικότητα, κοινωνικά δίκτυα, τηλεφωνία στο Διαδίκτυο.","student_evaluation":{"delivery_mode":"Πρόσωπο με πρόσωπο (αίθουσα διδασκαλίας)","use_of_ict":["Ηλεκτρονικό ταχυδρομείο","Ιστοσελίδα μαθήματος","Ηλεκτρονική υποβολή ασκήσεων"],"learning_activities_and_workload":[{"activity":"Διαλέξεις","workload_hours":52},{"activity":"Φροντιστήρια","workload_hours":26},{"activity":"Εργαστηριακές ασκήσεις - Project","workload_hours":50},{"activity":"Μελέτη θεωρίας","workload_hours":50}],"total_workload_hours":178,"assessment":{"assessment_language":"Γλώσσα ελληνική. Ενδέχεται να γίνεται και στην Αγγλική εάν υπάρχει ενδιαφέρον από αγγλόφωνο ακροατήριο.","components":[{"name":"τελικό διαγώνισμα","weight":"50%"},{"name":"γραπτή αναφορά","weight":"10%"},{"name":"προφορική παρουσίαση","weight":"10%"},{"name":"ασκήσεις","weight":"30%"}]}},"suggested_bibliography":"Marc  Crovella  and  B.  Krishnamurthy: \"Internet  Measurements:  Infrastructure,  Traffic,  and Applications\"."}
