{"general_info":{"course_id":"ΗΥ-208","course_title":"ΑΓΓΛΙΚΑ ΙΙΙ","instructor":"ΠΑΝΑΓΙΩΤΑ ΡΙΖΟΠΟΥΛΟΥ","teaching_semester":"ΧΕΙΜΕΡΙΝΟ","school":"ΘΕΤΙΚΩΝ ΚΑΙ ΤΕΧΝΟΛΟΓΙΚΩΝ ΕΠΙΣΤΗΜΩΝ","department":"ΕΠΙΣΤΗΜΗΣ ΥΠΟΛΟΓΙΣΤΩΝ","study_level":"ΠΡΟΠΤΥΧΙΑΚΟ","semester_of_studies":"3ο","autonomous_teaching_activities":{"activity_type":"Διαλέξεις","weekly_teaching_hours":4,"ects_credits":4},"course_type":"Ανάπτυξης Δεξιοτήτων","prerequisite_courses":["HY-109"],"language_of_instruction_and_exams":"Ελληνική / Αγγλική","offered_to_erasmus_students":"ΝΑΙ","course_website":"http://www.csd.uoc.gr/~hy208"},"course_objectives":{"learning_outcomes_text":"Οι φοιτητές, μετά την επιτυχή ολοκλήρωση του μαθήματος θα έχουν μία πρώτη εξοικείωση με επιστημονικά άρθρα στην επιστήμη των υπολογιστών στην αγγλική γλώσσα, θα είναι σε θέση να διακρίνουν ανάμεσα στα διαφορετικά τμήματα ενός τέτοιου άρθρου και θα μπορούν να κάνουν σύντομες παρουσιάσεις πάνω σε αυτό.","general_competencies":["Αναζήτηση, ανάλυση και σύνθεση δεδομένων και πληροφοριών, με τη χρήση και των απαραίτητων τεχνολογιών","Ομαδική εργασία","Προαγωγή της ελεύθερης, δημιουργικής και επαγωγικής σκέψης"]},"course_content":"• Introduction to Technical Communication   \n• Persuading Your Audience  \n• Teamwork and Global Considerations   \n• Thinking Critically about the Research Process   \n• Summarizing Research Findings and Other Information   \n• Editing for a Professional Style and Tone   \n• Designing Pages and Documents   \n• Resumes and Other Job-Search Materials   \n• Technical Descriptions, Specifications, and Marketing Materials","student_evaluation":{"delivery_mode":"Πρόσωπο με πρόσωπο (αίθουσα διδασκαλίας)","use_of_ict":["Ηλεκτρονικό ταχυδρομείο","Ιστοσελίδα μαθήματος"],"learning_activities_and_workload":[{"activity":"Διαλέξεις","workload_hours":52},{"activity":"Project (5)","workload_hours":25},{"activity":"Παρουσίαση","workload_hours":30}],"total_workload_hours":107,"assessment":{"assessment_language":"Αγγλική","components":[{"name":"Project","weight":"50%"},{"name":"Παρουσίαση","weight":"25%"},{"name":"Κριτική παρουσίασης συμφοιτητή","weight":"25%"}]}},"suggested_bibliography":"Σημειώσεις διδάσκουσας και επιστημονικά άρθρα.\n\n-Συναφή επιστημονικά περιοδικά:"}
