{"general_info":{"course_id":"ΗΥ-345","course_title":"ΛΕΙΤΟΥΡΓΙΚΑ ΣΥΣΤΗΜΑΤΑ","instructor":"ΕΥΑΓΓΕΛΟΣ ΜΑΡΚΑΤΟΣ","teaching_semester":"ΧΕΙΜΕΡΙΝΟ","school":"ΘΕΤΙΚΩΝ ΚΑΙ ΤΕΧΝΟΛΟΓΙΚΩΝ ΕΠΙΣΤΗΜΩΝ","department":"ΕΠΙΣΤΗΜΗΣ ΥΠΟΛΟΓΙΣΤΩΝ","study_level":"ΠΡΟΠΤΥΧΙΑΚΟ","semester_of_studies":"5ο","autonomous_teaching_activities":{"activity_type":"Διαλέξεις και φροντιστήρια","weekly_teaching_hours":6,"ects_credits":8},"course_type":"Υποβάθρου","prerequisite_courses":["HY-240","HY-255"],"language_of_instruction_and_exams":"Ελληνική. Ενδέχεται να γίνεται και στην Αγγλική εάν υπάρχει ενδιαφέρον από αγγλόφωνο ακροατήριο.","offered_to_erasmus_students":"ΝΑΙ","course_website":"http://www.csd.uoc.gr/~hy345"},"course_objectives":{"learning_outcomes_text":"Οι φοιτητές, μετά την επιτυχή ολοκλήρωση του μαθήματος\n\n θα κατέχουν τις βασικές έννοιες των λειτουργικών συστημάτων\n\n θα έχουν εξοικειωθεί με τον κώδικα ενός μεγάλου λειτουργικού συστήματος όπως το Linux\n\n θα έχουν μάθει τις βασικές αρχές συγχρονισμού διεργασιών και διαχείρισης μνήμης, και\n\n θα είναι σε θέση να κάνουν βελτιώσεις στον κώδικα πραγματικών λειτουργικών συστημάτων","general_competencies":["Αναζήτηση, ανάλυση και σύνθεση δεδομένων και πληροφοριών, με τη χρήση και των απαραίτητων τεχνολογιών","Προσαρμογή σε νέες καταστάσεις","Λήψη αποφάσεων","Αυτόνομη εργασία","Ομαδική εργασία","Σχεδιασμός και διαχείριση έργων","Προαγωγή της ελεύθερης, δημιουργικής και επαγωγικής σκέψης"]},"course_content":"Περιγραφή διαδικασιών λειτουργικού συστήματος και υλοποίησή τους: πολυ-προγραμματισμός, συγχρονισμός (σηματοφορείς), context switching, process scheduling, system calls, interrupt handlers, deadlock, device independent I/O, device drivers, disk scheduling, memory management, virtual memory, paging algorithms, file systems, distributed operating systems.","student_evaluation":{"delivery_mode":"Πρόσωπο με πρόσωπο (αίθουσα διδασκαλίας)","use_of_ict":["Ηλεκτρονικό ταχυδρομείο","Ιστοσελίδα μαθήματος","Ηλεκτρονική υποβολή και διαχείριση ασκήσεων / εργαστηρίων"],"learning_activities_and_workload":[{"activity":"Διαλέξεις","workload_hours":52},{"activity":"Φροντιστήρια","workload_hours":26},{"activity":"Εργαστηριακές ασκήσεις - project","workload_hours":80},{"activity":"Μελέτη θεωρίας","workload_hours":80}],"total_workload_hours":238,"assessment":{"assessment_language":"Γλώσσα ελληνική. Ενδέχεται να γίνεται και στην Αγγλική εάν υπάρχει ενδιαφέρον από αγγλόφωνο ακροατήριο.","components":[{"name":"Tελικό διαγώνισμα","weight":"70%"},{"name":"4 ασκήσεις","weight":"30%","notes":"(1:5%, 2:5%, 3:5%, 4:15%)"}]}},"suggested_bibliography":"\" Modern Operating Systems \" (3rd Edition) by Andrew Tanenbaum, Prentice Hall, 2007\n\nΕπιλογές Συγγραμμάτων στον ΕΥΔΟΞΟ:\n\n1. Βιβλίο [13884]: ΣΥΓΧΡΟΝΑ ΛΕΙΤΟΥΡΓΙΚΑ ΣΥΣΤΗΜΑΤΑ, ANDREW S. TANENBAUM\nΛεπτομέρειες  \n\n2. Βιβλίο [14841]: Λειτουργικά συστήματα, Silberschatz Abraham,Galvin Peter B. ,Gagne Greg\nΛεπτομέρειες"}
