{"general_info":{"course_id":"ΗΥ-109","course_title":"ΑΓΓΛΙΚΑ ΙΙ","instructor":"ΠΑΝΑΓΙΩΤΑ ΡΙΖΟΠΟΥΛΟΥ","teaching_semester":"ΕΑΡΙΝΟ","school":"ΘΕΤΙΚΩΝ ΚΑΙ ΤΕΧΝΟΛΟΓΙΚΩΝ ΕΠΙΣΤΗΜΩΝ","department":"ΕΠΙΣΤΗΜΗΣ ΥΠΟΛΟΓΙΣΤΩΝ","study_level":"ΠΡΟΠΤΥΧΙΑΚΟ","semester_of_studies":"2ο","autonomous_teaching_activities":{"activity_type":"Διαλέξεις","weekly_teaching_hours":4,"ects_credits":4},"course_type":"Ανάπτυξης Δεξιοτήτων","prerequisite_courses":["HY-108"],"language_of_instruction_and_exams":"Ελληνική / Αγγλική","offered_to_erasmus_students":"ΝΑΙ","course_website":"https://www.csd.uoc.gr/~hy109"},"course_objectives":{"learning_outcomes_text":"Το μάθημα αυτό αποτελεί συνέχεια του ΗΥ-108 «Αγγλικά Ι». Μέσα από μια σειρά διαλέξεων και υποτυπωδών ασκήσεων, η θεωρία της επιστήμης ενισχύεται από την κατανόηση θεμελιωδών ιδεών και ακαδημαϊκών αναγκών.  Μετά την επιτυχή ολοκλήρωση του μαθήματος, οι φοιτητές θα έχουν ολοκληρωμένη γνώση της εξειδικευμένης αγγλικής ορολογίας της επιστήμης των Υπολογιστών και θα έχουν εξοικειωθεί με τη γραπτή και θεωρητική διατύπωση βασικών θεωρητικών ζητημάτων της επιστήμης τους.","general_competencies":["Αναζήτηση, ανάλυση και σύνθεση δεδομένων και πληροφοριών, με τη χρήση και των απαραίτητων τεχνολογιών","Ομαδική εργασία","Επίδειξη κοινωνικής, επαγγελματικής και ηθικής υπευθυνότητας και ευαισθησίας σε θέματα φύλου","Άσκηση κριτικής και αυτοκριτικής","Προαγωγή της ελεύθερης, δημιουργικής και επαγωγικής σκέψης"]},"course_content":"• Background of Writing\n• Verbs - passives\n• Finding Suitable Sources\n• Verbs of Reference\n• From Understanding Titles to Planning\n• Workshop\n• Finding Key Points and Note-taking\n• Formal Letters and E-mails\n• Paraphrasing\n• Avoiding Plagiarism\n• Summarising\n• Reports\n• References and Quotations\n• Designing and Reporting Surveys\n• Combining Sources\n• Literature Reviews\n• Organizing Paragraphs\n• Introductions and Conclusions","student_evaluation":{"delivery_mode":"Πρόσωπο με πρόσωπο (αίθουσα διδασκαλίας)","use_of_ict":["Ηλεκτρονικό ταχυδρομείο","Ιστοσελίδα μαθήματος"],"learning_activities_and_workload":[{"activity":"Διαλέξεις","workload_hours":52},{"activity":"Μελέτη βιβλιογραφίας","workload_hours":50},{"activity":"Παρουσιάσεις","workload_hours":5}],"total_workload_hours":107,"assessment":{"assessment_language":"αγγλική","components":[{"name":"Παρουσίαση","weight":"20% (bonus)"},{"name":"Τελική γραπτή εξέταση","weight":"100%"}]}},"suggested_bibliography":"Σημειώσεις της διδάσκουσας"}
