{"general_info":{"course_id":"ΗΥ-118","course_title":"ΔΙΑΚΡΙΤΑ ΜΑΘΗΜΑΤΙΚΑ","instructor":"ΑΝΤΩΝΙΟΣ ΑΡΓΥΡΟΣ / ΓΕΩΡΓΙΟΣ ΓΕΩΡΓΑΚΟΠΟΥΛΟΣ","teaching_semester":"ΧΕΙΜΕΡΙΝΟ / ΕΑΡΙΝΟ","school":"ΘΕΤΙΚΩΝ ΚΑΙ ΤΕΧΝΟΛΟΓΙΚΩΝ ΕΠΙΣΤΗΜΩΝ","department":"ΕΠΙΣΤΗΜΗΣ ΥΠΟΛΟΓΙΣΤΩΝ","study_level":"ΠΡΟΠΤΥΧΙΑΚΟ","semester_of_studies":"2ο","autonomous_teaching_activities":{"activity_type":"Διαλέξεις και φροντιστήρια","weekly_teaching_hours":6,"ects_credits":6},"course_type":"Υποβάθρου","language_of_instruction_and_exams":"Ελληνική","offered_to_erasmus_students":"ΟΧΙ","course_website":"http://www.csd.uoc.gr/~hy118b/"},"course_objectives":{"learning_outcomes_text":"Με το τέλος του μαθήματος, ο φοιτητής θα πρέπει να μπορεί:\n\n να περιγράφει τους ορισμούς και τις ιδιότητες μιας ποικιλίας από ειδικούς τύπους διακριτών δομών\n\n να κατανοεί, αναπαριστάνει και αναλύει διαφόρους τύπους διακριτών δομών χρησιμοποιώντας τυπικούς συμβολισμούς\n\n να ελέγχει την ορθότητα απλών λογικών προτάσεων (απόδειξη)\n\n να κατασκευάζει δημιουργικά, με σαφήνεια και ορθότητα, απλές λογικές προτάσεις και σωστούς αλγορίθμους.","general_competencies":["Αναζήτηση, ανάλυση και σύνθεση δεδομένων και πληροφοριών, με τη χρήση και των απαραίτητων τεχνολογιών","Προσαρμογή σε νέες καταστάσεις","Αυτόνομη εργασία"]},"course_content":" Εισαγωγή στη Λογική (στοιχεία προτασιακού και κατηγορηματικού λογισμού)\n Εισαγωγή στην Θεωρία Συνόλων\n Μέθοδοι απόδειξης προτάσεων (ευθεία απόδειξη, απαγωγή σε άτοπο, μαθηματική επαγωγή, αρχή του περιστερώνα)\n Στοιχεία θεωρίας αριθμών\n Σχέσεις (ιδιότητες, σχέσεις ισοδυναμίας, σχέσεις μερικής και ολικής διάταξης)\n Συνδυαστική\n Διωνυμικοί συντελεστές\n Εισαγωγή στην Θεωρία Πιθανοτήτων\n Θεωρία Γράφων","student_evaluation":{"delivery_mode":"Πρόσωπο με πρόσωπο (αίθουσα διδασκαλίας)","use_of_ict":["Ηλεκτρονικό ταχυδρομείο","Ιστοσελίδα μαθήματος"],"learning_activities_and_workload":[{"activity":"Διαλέξεις","workload_hours":52},{"activity":"Φροντιστήρια","workload_hours":18},{"activity":"Ασκήσεις στο σπίτι","workload_hours":58},{"activity":"Μελέτη θεωρίας","workload_hours":52}],"total_workload_hours":180,"assessment":{"assessment_language":"Ελληνική","components":[{"name":"Τελική εξέταση","weight":"60-80%"},{"name":"Πρόοδος","weight":"0-20%"},{"name":"Σειρές ασκήσεων","weight":"0-20%"}]}},"suggested_bibliography":"-Προτεινόμενη Βιβλιογραφία :\n\nΔιακριτά μαθηματικά και εφαρμογές τους, Rosen Kenneth, και\n\nΔΙΑΚΡΙΤΑ ΜΑΘΗΜΑΤΙΚΑ ΜΕ ΕΦΑΡΜΟΓΕΣ, SUSANNA S. EPP\n\nΕπιλογές συγγραμμάτων στον Εύδοξο:\n\no Βιβλίο [18548969]: Διακριτά Μαθηματικά, Lipschutz Seymour, Lipson Marc Lars Λεπτομέρειες  \n\no Βιβλίο [13953]: ΔΙΑΚΡΙΤΑ ΜΑΘΗΜΑΤΙΚΑ ΜΕ ΕΦΑΡΜΟΓΕΣ, SUSANNA S. EPP Λεπτομέρειες  \n\no Βιβλίο [225]: ΣΤΟΙΧΕΙΑ ΔΙΑΚΡΙΤΩΝ ΜΑΘΗΜΑΤΙΚΩΝ, LIU C.L. Λεπτομέρειες  \n\no Βιβλίο [77106820]: Διακριτά μαθηματικά και εφαρμογές τους, 8η Έκδοση, Rosen Kenneth H., Παναγιώτης Μποζάνης (επιμέλεια) Λεπτομέρειες"}
