{"general_info":{"course_id":"ΗΥ-209","course_title":"ΑΓΓΛΙΚΑ IV","instructor":"ΠΑΝΑΓΙΩΤΑ ΡΙΖΟΠΟΥΛΟΥ","teaching_semester":"ΧΕΙΜΕΡΙΝΟ","school":"ΘΕΤΙΚΩΝ ΚΑΙ ΤΕΧΝΟΛΟΓΙΚΩΝ ΕΠΙΣΤΗΜΩΝ","department":"ΕΠΙΣΤΗΜΗΣ ΥΠΟΛΟΓΙΣΤΩΝ","study_level":"ΠΡΟΠΤΥΧΙΑΚΟ","semester_of_studies":"4ο","autonomous_teaching_activities":{"activity_type":"Διαλέξεις","weekly_teaching_hours":4,"ects_credits":4},"course_type":"Ανάπτυξης Δεξιοτήτων","prerequisite_courses":["HY-208"],"language_of_instruction_and_exams":"Ελληνική /Αγγλική","offered_to_erasmus_students":"ΝΑΙ","course_website":"http://www.csd.uoc.gr/~hy209"},"course_objectives":{"learning_outcomes_text":"Το μάθημα αποτελεί συνέχεια του ΗΥ-208 (Αγγλικά ΙΙΙ). Μετά την επιτυχή ολοκλήρωσή του, οι φοιτητές θα έχουν εμπεδώσει όλα τα εργαλεία την γραπτής καθώς και της προφορικής επικοινωνίας στην αγγλική γλώσσα, που σχετίζονται με το αντικείμενο της επιστήμης των υπολογιστών.","general_competencies":["Αναζήτηση, ανάλυση και σύνθεση δεδομένων και πληροφοριών, με τη χρήση και των απαραίτητων τεχνολογιών","Ομαδική εργασία","Άσκηση κριτικής και αυτοκριτικής","Προαγωγή της ελεύθερης, δημιουργικής και επαγωγικής σκέψης"]},"course_content":"• Review of the Research Paper\n• The Critical Approach\n• Mothods\n• Results\n• Discussion\n• Abstract and Title\n• Introductions\n• The Review of the Literature\n• Citations and References\n• PRESENTATIONS","student_evaluation":{"delivery_mode":"Πρόσωπο με πρόσωπο (αίθουσα διδασκαλίας)","use_of_ict":["Ηλεκτρονικό ταχυδρομείο","Ιστοσελίδα μαθήματος"],"learning_activities_and_workload":[{"activity":"Διαλέξεις","workload_hours":52},{"activity":"Project (5)","workload_hours":25},{"activity":"Παρουσίαση","workload_hours":30}],"total_workload_hours":107,"assessment":{"assessment_language":"Αγγλική","components":[{"name":"Project","weight":"50%"},{"name":"Παρουσίαση","weight":"25%"},{"name":"Κριτική παρουσίασης συμφοιτητή","weight":"25%"}]}},"suggested_bibliography":"Σημειώσεις διδάσκουσας και επιστημονικά άρθρα."}
